[
  {
    "concluded": "BUSL-1.1",
    "confidence": "high",
    "conflicting_evidence": false,
    "declared": null,
    "detected": [
      "BUSL-1.1"
    ],
    "evidence": [
      {
        "excerpt": "Business Source License 1.1\n\nParameters\n\nLicensor:              Clean Room Coding Contributors\nLicensed Work:         Clean Room Coding Version 0.1.0 (and each subsequent version released\n                       under this License)\n                       The Licensed Work is (c) 2026 Clean Room Coding Contributors\nAdditional Use Grant:  You may use, copy, modify, self-host and make production use o",
        "source": "LICENSE"
      }
    ],
    "path": "LICENSE",
    "policy_result": {
      "notes": "All terms in 'BUSL-1.1' are explicitly allowed by project policy.",
      "obligations": [
        "Comply with whatever the specific project's Additional Use Grant permits/restricts -- this varies per BUSL adopter and must be read per-project, not assumed.",
        "Reproduce the licence text and Parameters block (Licensor, Licensed Work, Additional Use Grant, Change Date, Change License) in copies/redistributions.",
        "Track the Change Date per version -- a specific released version converts to the stated Change License on that date regardless of the current version's terms."
      ],
      "status": "allowed"
    }
  },
  {
    "concluded": "BUSL-1.1",
    "confidence": "high",
    "conflicting_evidence": false,
    "declared": null,
    "detected": [
      "BUSL-1.1"
    ],
    "evidence": [
      {
        "excerpt": "Clean Room Coding\nCopyright 2026 Clean Room Coding Contributors\n\nThis product includes software developed by the Clean Room Coding project\n(https://github.com/khhvmc5g6f-eng/clean-room-coding).\n\nLicensed under the Business Source License 1.1 (see LICENSE). This is a\nsource-available licence, not an OSI-approved open-source licence: you may\nuse, copy, modify, self-host and make production use of th",
        "source": "NOTICE"
      }
    ],
    "path": "NOTICE",
    "policy_result": {
      "notes": "All terms in 'BUSL-1.1' are explicitly allowed by project policy.",
      "obligations": [
        "Comply with whatever the specific project's Additional Use Grant permits/restricts -- this varies per BUSL adopter and must be read per-project, not assumed.",
        "Reproduce the licence text and Parameters block (Licensor, Licensed Work, Additional Use Grant, Change Date, Change License) in copies/redistributions.",
        "Track the Change Date per version -- a specific released version converts to the stated Change License on that date regardless of the current version's terms."
      ],
      "status": "allowed"
    }
  },
  {
    "concluded": "GPL-3.0-only",
    "confidence": "high",
    "conflicting_evidence": false,
    "declared": null,
    "detected": [
      "GPL-3.0-only"
    ],
    "evidence": [
      {
        "excerpt": "GNU GENERAL PUBLIC LICENSE\nVersion 3, 29 June 2007\n\nCopyright (c) 2026 Clean Room Coding Contributors (synthetic benchmark fixture)\n\nThis program is free software: you can redistribute it and/or modify it\nunder the terms of the GNU General Public License as published by the\nFree Software Foundation, either version 3 of the License, or (at your\noption) any later version.",
        "source": "LICENSE"
      }
    ],
    "path": "tests/fixtures/benchmark/contaminated-clone/LICENSE",
    "policy_result": {
      "notes": "'GPL-3.0-only' is not fully covered by the project's allow/deny lists.",
      "obligations": [
        "Provide the Corresponding Source (or a written offer for it) alongside any distributed object/executable form.",
        "License the combined/derivative work as a whole under GPL-3.0-or-later-compatible terms.",
        "Preserve copyright and licence notices, and a copy of the GPL-3.0 text.",
        "Do not impose further restrictions beyond those the GPL itself permits (no additional restrictions clause).",
        "Convey Installation Information for User Products where the anti-Tivoization provisions apply (GPLv3 section 6)."
      ],
      "status": "needs_review"
    }
  },
  {
    "concluded": "GPL-3.0-only",
    "confidence": "high",
    "conflicting_evidence": false,
    "declared": null,
    "detected": [
      "GPL-3.0-only"
    ],
    "evidence": [
      {
        "excerpt": "GNU GENERAL PUBLIC LICENSE\nVersion 3, 29 June 2007\n\nCopyright (c) 2026 Clean Room Coding Contributors (synthetic benchmark fixture)\n\nThis program is free software: you can redistribute it and/or modify it\nunder the terms of the GNU General Public License as published by the\nFree Software Foundation, either version 3 of the License, or (at your\noption) any later version.",
        "source": "LICENSE"
      }
    ],
    "path": "tests/fixtures/benchmark/gpl-app/LICENSE",
    "policy_result": {
      "notes": "'GPL-3.0-only' is not fully covered by the project's allow/deny lists.",
      "obligations": [
        "Provide the Corresponding Source (or a written offer for it) alongside any distributed object/executable form.",
        "License the combined/derivative work as a whole under GPL-3.0-or-later-compatible terms.",
        "Preserve copyright and licence notices, and a copy of the GPL-3.0 text.",
        "Do not impose further restrictions beyond those the GPL itself permits (no additional restrictions clause).",
        "Convey Installation Information for User Products where the anti-Tivoization provisions apply (GPLv3 section 6)."
      ],
      "status": "needs_review"
    }
  },
  {
    "concluded": "MIT",
    "confidence": "high",
    "conflicting_evidence": false,
    "declared": null,
    "detected": [
      "MIT"
    ],
    "evidence": [
      {
        "excerpt": "MIT License\n\nCopyright (c) 2026 Clean Room Coding Contributors (synthetic benchmark fixture)\n\nPermission is hereby granted, free of charge, to any person obtaining a copy\nof this software and associated documentation files (the \"Software\"), to deal\nin the Software without restriction, including without limitation the rights\nto use, copy, modify, merge, publish, distribute, sublicense, and/or sell",
        "source": "LICENSE"
      }
    ],
    "path": "tests/fixtures/benchmark/independent-clone/LICENSE",
    "policy_result": {
      "notes": "All terms in 'MIT' are explicitly allowed by project policy.",
      "obligations": [
        "Reproduce the original copyright notice and the full MIT licence text in all copies or substantial portions of the software.",
        "The software is provided \"as is\", without warranty -- do not represent otherwise."
      ],
      "status": "allowed"
    }
  },
  {
    "concluded": "MIT",
    "confidence": "high",
    "conflicting_evidence": false,
    "declared": null,
    "detected": [
      "MIT"
    ],
    "evidence": [
      {
        "excerpt": "MIT License\n\nCopyright (c) 2026 Clean Room Coding Contributors (synthetic benchmark fixture)\n\nPermission is hereby granted, free of charge, to any person obtaining a copy\nof this software and associated documentation files (the \"Software\"), to deal\nin the Software without restriction, including without limitation the rights\nto use, copy, modify, merge, publish, distribute, sublicense, and/or sell",
        "source": "LICENSE"
      }
    ],
    "path": "tests/fixtures/benchmark/permissive-app/LICENSE",
    "policy_result": {
      "notes": "All terms in 'MIT' are explicitly allowed by project policy.",
      "obligations": [
        "Reproduce the original copyright notice and the full MIT licence text in all copies or substantial portions of the software.",
        "The software is provided \"as is\", without warranty -- do not represent otherwise."
      ],
      "status": "allowed"
    }
  },
  {
    "concluded": null,
    "confidence": "medium",
    "conflicting_evidence": false,
    "declared": "\\s*([^\\n\\r]+)\")",
    "detected": [],
    "evidence": [
      {
        "excerpt": "\\s*([^\\n\\r]+)\")",
        "source": "SPDX-License-Identifier header"
      }
    ],
    "path": "src/cleanroom/licence/discovery.py",
    "policy_result": {
      "notes": "No licence could be concluded from available evidence.",
      "obligations": [],
      "status": "unknown"
    }
  },
  {
    "concluded": "GPL-3.0-only",
    "confidence": "high",
    "conflicting_evidence": false,
    "declared": "GPL-3.0-only",
    "detected": [],
    "evidence": [
      {
        "excerpt": "GPL-3.0-only",
        "source": "SPDX-License-Identifier header"
      }
    ],
    "path": "tests/fixtures/benchmark/contaminated-clone/sorter.py",
    "policy_result": {
      "notes": "'GPL-3.0-only' is not fully covered by the project's allow/deny lists.",
      "obligations": [
        "Provide the Corresponding Source (or a written offer for it) alongside any distributed object/executable form.",
        "License the combined/derivative work as a whole under GPL-3.0-or-later-compatible terms.",
        "Preserve copyright and licence notices, and a copy of the GPL-3.0 text.",
        "Do not impose further restrictions beyond those the GPL itself permits (no additional restrictions clause).",
        "Convey Installation Information for User Products where the anti-Tivoization provisions apply (GPLv3 section 6)."
      ],
      "status": "needs_review"
    }
  },
  {
    "concluded": "GPL-3.0-only",
    "confidence": "high",
    "conflicting_evidence": false,
    "declared": "GPL-3.0-only",
    "detected": [],
    "evidence": [
      {
        "excerpt": "GPL-3.0-only",
        "source": "SPDX-License-Identifier header"
      }
    ],
    "path": "tests/fixtures/benchmark/gpl-app/wobble_sort.py",
    "policy_result": {
      "notes": "'GPL-3.0-only' is not fully covered by the project's allow/deny lists.",
      "obligations": [
        "Provide the Corresponding Source (or a written offer for it) alongside any distributed object/executable form.",